"priority","status","school_name","city_state","website","source_url","public_contact","phone","email","decision_maker","fit_reason","enrollment_signal","first_observation","next_action","last_touch","next_touch","notes"
"B","New Lead","La Petite Academy of Thornton","Needs city verification, CO","https://www.lapetite.com/your-local-school/thornton-co-7249/?utm_source=google&utm_medium=local&utm_campaign=localmaps&utm_content=7249","https://www.google.com/maps/place/La+Petite+Academy+of+Thornton/data=!4m7!3m6!1s0x876c740a2309d33f:0x9b968d91891e4172!8m2!3d39.920902!4d-104.9406649!16s%2Fg%2F1tdvknz5!19sChIJP9MJIwp0bIcRckEeiZGNlps?authuser=0&hl=en&rclk=1","General office","877-271-6466","","Unknown","Early education / childcare prospect from user list","Day care center; 4 rating; 63 Google reviews","Public website and Google listing are present; audit should focus on turning parent interest into inquiry or tour requests. Review language suggests parent trust can be used more intentionally.","Verify city/contact, add one school-specific observation, then email and call.","","","Imported from user CSV. Address: 3900 E 124th Ave. Hours/export note: Closed."
"B","New Lead","La Petite Academy of Westminster","Needs city verification, CO","https://www.lapetite.com/your-local-school/westminster-co-7250/?utm_source=google&utm_medium=local&utm_campaign=localmaps&utm_content=7250","https://www.google.com/maps/place/La+Petite+Academy+of+Westminster/data=!4m7!3m6!1s0x876b8a22d722ecb9:0x8ec3febc5bc07e16!8m2!3d39.8994146!4d-105.0584477!16s%2Fg%2F1td4_blp!19sChIJuewi1yKKa4cRFn7AW7z-w44?authuser=0&hl=en&rclk=1","General office","877-271-6466","","Unknown","Early education / childcare prospect from user list","Day care center; 4.1 rating; 23 Google reviews","Public website and Google listing are present; audit should focus on turning parent interest into inquiry or tour requests. Review language suggests parent trust can be used more intentionally.","Verify city/contact, add one school-specific observation, then email and call.","","","Imported from user CSV. Address: 11180 Eaton St. Hours/export note: Closed."
"B","New Lead","Little Boots Early Learning Center","Needs city verification, CO","https://www.littlebootslearning.com/","https://www.google.com/maps/place/Little+Boots+Early+Learning+Center/data=!4m7!3m6!1s0x876c75ce80c76c79:0xf4d5aa6f972af397!8m2!3d39.9113223!4d-104.9917736!16s%2Fg%2F11bzt5ns98!19sChIJeWzHgM51bIcRl_Mql2-q1fQ?authuser=0&hl=en&rclk=1","General office","303-452-8200","","Unknown","Early education / childcare prospect from user list","Preschool; 4.1 rating; 36 Google reviews","Public website and Google listing are present; audit should focus on turning parent interest into inquiry or tour requests. Review language suggests parent trust can be used more intentionally.","Verify city/contact, add one school-specific observation, then email and call.","","","Imported from user CSV. Address: 11840 Delaware Ct. Hours/export note: Closed."
"B","New Lead","Little Lights Christian Early Learning Center","Needs city verification, CO","https://www.littlelights-christian.org/","https://www.google.com/maps/place/Little+Lights+Christian+Early+Learning+Center/data=!4m7!3m6!1s0x876c74d083657eed:0xa8153728bb16be63!8m2!3d39.9712299!4d-104.977667!16s%2Fg%2F1vvr6pw5!19sChIJ7X5lg9B0bIcRY74Wuyg3Fag?authuser=0&hl=en&rclk=1","General office","720-872-2200","","Unknown","Early education / childcare prospect from user list","Preschool; 5 rating; 26 Google reviews","Public website and Google listing are present; audit should focus on turning parent interest into inquiry or tour requests. Review language suggests parent trust can be used more intentionally.","Verify city/contact, add one school-specific observation, then email and call.","","","Imported from user CSV. Address: 15150 Washington St. Hours/export note: Closed."
"B","New Lead","Little Smiles Bilingual Daycare","Needs city verification, CO","https://littlesmilesbilingualdaycare.com/","https://www.google.com/maps/place/Little+Smiles+Bilingual+Daycare/data=!4m7!3m6!1s0x876c77996b64c31f:0x5d99cabb60aab5c4!8m2!3d39.8721197!4d-104.9981016!16s%2Fg%2F11kk0qhym2!19sChIJH8Nka5l3bIcRxLWqYLvKmV0?authuser=0&hl=en&rclk=1","General office","720-206-7899","","Unknown","Early education / childcare prospect from user list","Day care center; 5 rating; 26 Google reviews","Public website and Google listing are present; audit should focus on turning parent interest into inquiry or tour requests. Review language suggests parent trust can be used more intentionally.","Verify city/contact, add one school-specific observation, then email and call.","","","Imported from user CSV. Address: . Hours/export note: Closed."
"B","New Lead","Little Sunshine's Playhouse of Thornton, CO","Needs city verification, CO","https://littlesunshine.com/school/thornton-colorado/?utm_source=google&utm_medium=thornton-gbp&utm_campaign=thornton-gbp","https://www.google.com/maps/place/Little+Sunshine%27s+Playhouse+of+Thornton,+CO/data=!4m7!3m6!1s0x876c73f3cdb42355:0x7a921a18b34f4feb!8m2!3d39.927317!4d-104.904346!16s%2Fg%2F11w42q4g77!19sChIJVSO0zfNzbIcR609Psxgakno?authuser=0&hl=en&rclk=1","General office","720-571-0192","","Unknown","Early education / childcare prospect from user list","Preschool; 4.7 rating; 55 Google reviews","Public website and Google listing are present; audit should focus on turning parent interest into inquiry or tour requests. Review language suggests parent trust can be used more intentionally.","Call today or next business morning and ask for director/enrollment contact.","2026-06-04","","Imported from user CSV. Address: 7124 E 128th Ave. Hours/export note: Closed. Facebook page messaged 2026-06-04."
"B","New Lead","Littleton Montessori School","Littleton, CO","https://littletonmontessori.com","https://littletonmontessori.com/programs/","General office","303-972-8555","","Unknown","Local Montessori school serving 12 months through kindergarten","Programs page asks families to call to visit for a tour","Tour next step appears phone-based; audit can focus on missed-call recovery and clearer inquiry capture","Find email/contact form; call if email not public","","","Good fit for phone-first approach."
"B","New Lead","Mom's House Learning Center","Needs city verification, CO","https://www.momshouselearningcenter.com/","https://www.google.com/maps/place/Mom%27s+House+Learning+Center/data=!4m7!3m6!1s0x4077267f3df3a3b5:0xa52c10d27197311a!8m2!3d39.9128421!4d-104.9553547!16s%2Fg%2F11b6b3pcbb!19sChIJtaPzPX8md0ARGjGXcdIQLKU?authuser=0&hl=en&rclk=1","General office","720-800-7259","","Unknown","Early education / childcare prospect from user list","Child care agency; 5 rating; 67 Google reviews","Public website and Google listing are present; audit should focus on turning parent interest into inquiry or tour requests. Review language suggests parent trust can be used more intentionally.","Verify city/contact, add one school-specific observation, then email and call.","","","Imported from user CSV. Address: 2650, 2636 E 120th Ave. Hours/export note: Closed."
"B","New Lead","Montessori Children's House of Denver","Denver, CO","https://mchdenver.org","https://mchdenver.org/classroom/primary/","Admissions / Executive Director","303-320-4900","excdirector@mchdenver.org","Unknown","Private Montessori serving toddlers, primary, and elementary","Primary page has schedule-tour CTA and enrollment language","Program page has tour CTAs; audit can inspect whether parents see availability, trust, and next steps quickly","Verify current contact from official site, then send","","","Contact data partly from directory result; verify before outreach."
"B","New Lead","New Horizon Academy","Needs city verification, CO","https://www.newhorizonacademy.net/location/thornton-co/","https://www.google.com/maps/place/New+Horizon+Academy/data=!4m7!3m6!1s0x876c75bf4e786461:0xad1153af11f6b642!8m2!3d39.9462951!4d-104.9398295!16s%2Fg%2F11yg_wc716!19sChIJYWR4Tr91bIcRQrb2Ea9TEa0?authuser=0&hl=en&rclk=1","General office","720-336-7934","","Unknown","Early education / childcare prospect from user list","Day care center; 4.3 rating; 12 Google reviews","Public website and Google listing are present; audit should focus on turning parent interest into inquiry or tour requests. Review language suggests parent trust can be used more intentionally.","Verify city/contact, add one school-specific observation, then email and call.","","","Imported from user CSV. Address: 13802 Colorado Blvd. Hours/export note: Closed."
"B","New Lead","Noah's Ark Learning Center","Needs city verification, CO","https://www.noahsarklc.com/","https://www.google.com/maps/place/Noah%27s+Ark+Learning+Center/data=!4m7!3m6!1s0x876c760292636abb:0xa65f47e8149149c7!8m2!3d39.885654!4d-105.031037!16s%2Fg%2F1tj2ch6r!19sChIJu2pjkgJ2bIcRx0mRFOhHX6Y?authuser=0&hl=en&rclk=1","General office","303-466-6887","","Unknown","Early education / childcare prospect from user list","Day care center; 4.3 rating; 23 Google reviews","Public website and Google listing are present; audit should focus on turning parent interest into inquiry or tour requests. Review language suggests parent trust can be used more intentionally.","Verify city/contact, add one school-specific observation, then email and call.","","","Imported from user CSV. Address: 3501 W 104th Ave. Hours/export note: Closed."
"B","New Lead","Northside Baptist Church & Daycare","Needs city verification, CO","https://visitnbc.com/","https://www.google.com/maps/place/Northside+Baptist+Church+%26+Daycare/data=!4m7!3m6!1s0x876c742f276add29:0xac4a1c6fb944dc72!8m2!3d39.9062754!4d-104.9769149!16s%2Fg%2F1td5xn5q!19sChIJKd1qJy90bIcRctxEuW8cSqw?authuser=0&hl=en&rclk=1","General office","303-452-6721","","Unknown","Early education / childcare prospect from user list","Child care agency; 5 rating; 12 Google reviews","Public website and Google listing are present; audit should focus on turning parent interest into inquiry or tour requests. Review language suggests parent trust can be used more intentionally.","Verify city/contact, add one school-specific observation, then email and call.","","","Imported from user CSV. Address: 11550 Washington St. Hours/export note: Closes soon."
"B","New Lead","Nurtured Journey Preschool","Needs city verification, CO","https://www.nurturedjourneypreschool.com/","https://www.google.com/maps/place/Nurtured+Journey+Preschool/data=!4m7!3m6!1s0x876c7748dc7d4ca1:0x1fe435a47735055!8m2!3d39.870882!4d-104.9500443!16s%2Fg%2F11y4l7bzqz!19sChIJoUx93Eh3bIcRVVBzR1pD_gE?authuser=0&hl=en&rclk=1","General office","720-883-6777","","Unknown","Early education / childcare prospect from user list","Child care agency; 4.4 rating; 19 Google reviews","Public website and Google listing are present; audit should focus on turning parent interest into inquiry or tour requests. Review language suggests parent trust can be used more intentionally.","Verify city/contact, add one school-specific observation, then email and call.","","","Imported from user CSV. Address: 3142 E 96th Pl. Hours/export note: Closed."
"B","New Lead","Parker Montessori","Parker, CO","https://parkermontessori.com","https://parkermontessori.com/locations/parker-co/","General office","720-802-4363","","Unknown","Private preschool/childcare center with Montessori positioning","Call to check availability and schedule a tour","Phone-first tour path; audit can focus on missed-call recovery and clearer website conversion","Find email/contact form; call if no email","","","Good for phone-first outreach."
"B","New Lead","Primrose School at Torrey Peaks","Needs city verification, CO","https://www.primroseschools.com/schools/torrey-peaks/?utm_source=gbp&utm_medium=maplistings","https://www.google.com/maps/place/Primrose+School+at+Torrey+Peaks/data=!4m7!3m6!1s0x876b8a40264976b5:0x3c50eb5bf794a89d!8m2!3d39.912097!4d-105.05608!16s%2Fg%2F1tdww58c!19sChIJtXZJJkCKa4cRnaiU91vrUDw?authuser=0&hl=en&rclk=1","General office","303-246-4203","","Unknown","Early education / childcare prospect from user list","Preschool; 4.1 rating; 55 Google reviews","Public website and Google listing are present; audit should focus on turning parent interest into inquiry or tour requests. Review language suggests parent trust can be used more intentionally.","Verify city/contact, add one school-specific observation, then email and call.","","","Imported from user CSV. Address: 5483 W 118th Pl. Hours/export note: Closed."
"B","New Lead","Primrose School of Thornton","Needs city verification, CO","https://www.primroseschools.com/schools/thornton/?utm_source=gbp&utm_medium=maplistings","https://www.google.com/maps/place/Primrose+School+of+Thornton/data=!4m7!3m6!1s0x876c744d80cc2615:0x78f8ccf1f385aa67!8m2!3d39.929969!4d-104.982471!16s%2Fg%2F1tm8l1yk!19sChIJFSbMgE10bIcRZ6qF8_HM-Hg?authuser=0&hl=en&rclk=1","General office","303-279-0525","","Unknown","Early education / childcare prospect from user list","Preschool; 4.6 rating; 33 Google reviews","Public website and Google listing are present; audit should focus on turning parent interest into inquiry or tour requests. Review language suggests parent trust can be used more intentionally.","Verify city/contact, add one school-specific observation, then email and call.","","","Imported from user CSV. Address: 12899 Grant Dr. Hours/export note: Closed."
"B","New Lead","Purple Moon Early Learning Center","Needs city verification, CO","http://www.purplemoonelc.com/","https://www.google.com/maps/place/Purple+Moon+Early+Learning+Center/data=!4m7!3m6!1s0x876c767a31f7f933:0xc5efd991d733144e!8m2!3d39.8925832!4d-104.994736!16s%2Fg%2F11gfn74hrv!19sChIJM_n3MXp2bIcRThQz15HZ78U?authuser=0&hl=en&rclk=1","General office","303-482-2383","","Unknown","Early education / childcare prospect from user list","Child care agency; 4.4 rating; 28 Google reviews","Public website and Google listing are present; audit should focus on turning parent interest into inquiry or tour requests. Review language suggests parent trust can be used more intentionally.","Verify city/contact, add one school-specific observation, then email and call.","","","Imported from user CSV. Address: 650 Kennedy Dr. Hours/export note: Closed."
"B","New Lead","Room to Bloom Preschool","Needs city verification, CO","http://www.roomtobloomthornton.com/","https://www.google.com/maps/place/Room+to+Bloom+Preschool/data=!4m7!3m6!1s0x876c73e8f209e959:0x846d9422d376fc7!8m2!3d39.9200362!4d-104.9198444!16s%2Fg%2F11b6_gn8bq!19sChIJWekJ8uhzbIcRx283LULZRgg?authuser=0&hl=en&rclk=1","General office","720-304-5953","","Unknown","Early education / childcare prospect from user list","Preschool; 5 rating; 19 Google reviews","Public website and Google listing are present; audit should focus on turning parent interest into inquiry or tour requests. Review language suggests parent trust can be used more intentionally.","Verify city/contact, add one school-specific observation, then email and call.","","","Imported from user CSV. Address: 123rd Avenue & Holly St. Thornton. Hours/export note: Closed."
"B","New Lead","School in the Woods Montessori","Denver, CO","https://schoolinthewoodsmontessori.org","https://www.schoolinthewoodsmontessori.org/admissions","Administrator / info","720-201-3929","info@schoolinthewoodsmontessori.org; mpatton@schoolinthewoodsmontessori.org","Melody Patton","Private Montessori; local niche fit","Applications begin Nov 1 for next school year; admissions page exists","Enrollment timing may be less urgent for June, but local private Montessori fit is strong","Send only after A prospects; focus on waitlist/future-year inquiry flow","","","Contact from admissions page and NAMTA directory should be verified before sending."
"B","New Lead","Shapes of Tomorrow Montessori Preschool","Needs city verification, CO","http://www.sotmontessori.com/","https://www.google.com/maps/place/Shapes+of+Tomorrow+Montessori+Preschool/data=!4m7!3m6!1s0x876b89c7142c6f9b:0xb2aecc5788d54ce7!8m2!3d39.8383985!4d-105.0543988!16s%2Fg%2F11jn31v971!19sChIJm28sFMeJa4cR50zViFfMrrI?authuser=0&hl=en&rclk=1","General office","720-642-3880","","Unknown","Early education / childcare prospect from user list","Preschool; 4.9 rating; 17 Google reviews","Public website and Google listing are present; audit should focus on turning parent interest into inquiry or tour requests. Review language suggests parent trust can be used more intentionally.","Verify city/contact, add one school-specific observation, then email and call.","","","Imported from user CSV. Address: 5240 W 78th Pl. Hours/export note: Closed."
"B","New Lead","Step By Step Child Development","Needs city verification, CO","https://www.stepbystepchildcare.net/about-us","https://www.google.com/maps/place/Step+By+Step+Child+Development/data=!4m7!3m6!1s0x876c767b095560b3:0xfc07fcfdb77a4f09!8m2!3d39.890279!4d-104.9940745!16s%2Fg%2F1td7ntj1!19sChIJs2BVCXt2bIcRCU96t_38B_w?authuser=0&hl=en&rclk=1","General office","303-451-1740","","Unknown","Early education / childcare prospect from user list","Day care center; 3.5 rating; 49 Google reviews","Public website and Google listing are present; audit should focus on turning parent interest into inquiry or tour requests. Review language suggests parent trust can be used more intentionally.","Verify city/contact, add one school-specific observation, then email and call.","","","Imported from user CSV. Address: 10689 Melody Dr. Hours/export note: Closed."
"B","New Lead","The Academy ECE of Westminster","Needs city verification, CO","https://www.google.com/aclk?sa=L&ai=DChsSEwj9pJSiqeyUAxXMhsIIHbSMFIMYACICCAEQARoCamY&ae=2&aspm=1&co=1&ase=2&gclid=Cj0KCQjwof_QBhCgARIsADaMzOdtCHjg4qtCS7NvaDQWM0kjNZUi8-x0qfFvTq8ELp9hk-Dc8HRrKQgaAqa2EALw_wcB&cid=CAAS0wHkaI2weSambEjYisfs1Z9gyYlUWO1J4qfl33c7h4ADwWxSa9hJB2iq4XSLQqIm15ps4T_NLMMlc9quC0RcBFCMo4asTOqAQEv3mnYLziYolUBALZq9tsA8dNozcfAXAgSVmHXE4SnCudkw5UPqdn5NnLGX3lXXgukCFP3LlgpSnv9iZ3L8ZeAdWohHPMEONbGeYiQYZs5TJ4bm9cyl48SrWov63_PcqEoEa_YEVbtB5jZQslOGl6X3q6dAPx84I6UQYUlroSCgmknusnakFvI1uz8w&cce=2&category=acrcp_v1_35&sig=AOD64_2MNxBG4gcKEMUDOsEAFKZuw_39_A&adurl&q&ctype=99&nis=6","https://www.google.com/maps/place/The+Academy+ECE+of+Westminster/data=!4m7!3m6!1s0x876b8a17606f1f27:0x9e6888787561ba3c!8m2!3d39.900913!4d-105.051468!16s%2Fg%2F1th5jyz3!19sChIJJx9vYBeKa4cRPLphdXiIaJ4?authuser=0&hl=en&rclk=1","General office","303-438-8610","","Unknown","Early education / childcare prospect from user list","Preschool; 4.6 rating; 68 Google reviews","Public website and Google listing are present; audit should focus on turning parent interest into inquiry or tour requests.","Verify city/contact, add one school-specific observation, then email and call.","","","Imported from user CSV. Address: Closed. Hours/export note: Opens 6:45 AM Thu."
"B","New Lead","The Children's Center Preschool","Needs city verification, CO","https://mckaychildcenter.com/","https://www.google.com/maps/place/The+Children%27s+Center+Preschool/data=!4m7!3m6!1s0x876c75662d91fa95:0x69833dbd0ee13114!8m2!3d39.9521423!4d-105.0214389!16s%2Fg%2F1th5jz00!19sChIJlfqRLWZ1bIcRFDHhDr09g2k?authuser=0&hl=en&rclk=1","General office","303-438-9788","","Unknown","Early education / childcare prospect from user list","Preschool; 5 rating; 59 Google reviews","Public website and Google listing are present; audit should focus on turning parent interest into inquiry or tour requests. Review language suggests parent trust can be used more intentionally.","Verify city/contact, add one school-specific observation, then email and call.","","","Imported from user CSV. Address: 14076 McKay Park Cir. Hours/export note: Closed."
"B","New Lead","The Goddard School of Thornton","Needs city verification, CO","https://www.goddardschool.com/schools/co/thornton/thornton?utm_source=google&utm_medium=business_listings&utm_campaign=school&utm_content=main_button","https://www.google.com/maps/place/The+Goddard+School+of+Thornton/data=!4m7!3m6!1s0x876c73808ae94c2f:0x313acca6b5617381!8m2!3d39.9434022!4d-104.9373735!16s%2Fg%2F1tf6h3nb!19sChIJL0zpioBzbIcRgXNhtabMOjE?authuser=0&hl=en&rclk=1","General office","303-254-4144","","Unknown","Early education / childcare prospect from user list","Day care center; 4.7 rating; 45 Google reviews","Public website and Google listing are present; audit should focus on turning parent interest into inquiry or tour requests. Review language suggests parent trust can be used more intentionally.","Call today or next business morning and ask for owner/director/enrollment contact.","2026-06-04","","Imported from user CSV. Address: 4203 E 136th Ave. Hours/export note: Closed. Facebook page messaged 2026-06-04."
"B","New Lead","The Goddard School of Westminster","Needs city verification, CO","https://www.goddardschool.com/schools/co/westminster/westminster?utm_source=google&utm_medium=business_listings&utm_campaign=school&utm_content=main_button","https://www.google.com/maps/place/The+Goddard+School+of+Westminster/data=!4m7!3m6!1s0x876b8a73251e92bf:0x2f1d2332610dcb19!8m2!3d39.913082!4d-105.040579!16s%2Fg%2F1tx8tps2!19sChIJv5IeJXOKa4cRGcsNYTIjHS8?authuser=0&hl=en&rclk=1","General office","303-635-1790","","Unknown","Early education / childcare prospect from user list","Day care center; 4.8 rating; 68 Google reviews","Public website and Google listing are present; audit should focus on turning parent interest into inquiry or tour requests. Review language suggests parent trust can be used more intentionally.","Verify city/contact, add one school-specific observation, then email and call.","","","Imported from user CSV. Address: 4147 Main St. Hours/export note: Closed."
"B","Needs Call/Email","The Learning Experience - Thornton","Needs city verification, CO","https://thelearningexperience.com/centers/thornton/?utm_source=google&utm_medium=organic&utm_campaign=gbp_listing","https://www.google.com/maps/place/The+Learning+Experience+-+Thornton/data=!4m7!3m6!1s0x876c73e3fbcc2bab:0xaf4b2319301bea08!8m2!3d39.9118279!4d-104.9228937!16s%2Fg%2F11f4lf1yhh!19sChIJqyvM--NzbIcRCOobMBkjS68?authuser=0&hl=en&rclk=1","General office","303-450-9652","","Unknown","Early education / childcare prospect from user list","Day care center; 4.4 rating; 28 Google reviews","Public website and Google listing are present; audit should focus on turning parent interest into inquiry or tour requests. Review language suggests parent trust can be used more intentionally.","Facebook returned auto-DM; call 303-450-9652 or find/send email/contact form. Ask for center director or enrollment contact.","2026-06-04","","Imported from user CSV. Address: 11901 Holly St. Hours/export note: Closes soon. Facebook page messaged 2026-06-04. Facebook 2026-06-04: auto-DM response only; treat as not meaningfully reached. Use call/email/contact form next."
"B","New Lead","The Learning Experience - Westminster - Orchard","Needs city verification, CO","https://thelearningexperience.com/centers/westminster-orchard/?utm_source=google&utm_medium=organic&utm_campaign=gbp_listing","https://www.google.com/maps/place/The+Learning+Experience+-+Westminster+-+Orchard/data=!4m7!3m6!1s0x876c750625e7b5a9:0x832ea90032976ae5!8m2!3d39.9417931!4d-104.9985355!16s%2Fg%2F11f3_5dz1v!19sChIJqbXnJQZ1bIcR5WqXMgCpLoM?authuser=0&hl=en&rclk=1","General office","303-451-1373","","Unknown","Early education / childcare prospect from user list","Day care center; 4.5 rating; 38 Google reviews","Public website and Google listing are present; audit should focus on turning parent interest into inquiry or tour requests. Review language suggests parent trust can be used more intentionally.","Verify city/contact, add one school-specific observation, then email and call.","","","Imported from user CSV. Address: 13539 Huron St. Hours/export note: Closes soon."
"B","New Lead","The Springs Montessori","Colorado Springs, CO","https://www.springsmontessori.com","https://www.springsmontessori.com/admission-process/","Info","","info@springsmontessori.com","Unknown","Regional Montessori with structured admissions process","Tours scheduled weekday mornings; application follows tour","Admissions page is clear; audit can focus on whether Google/search and homepage drive to tour","Find phone; send admission-process observation email","","","Good regional prospect."
"B","New Lead","Thomas Learning Centers","Needs city verification, CO","http://thomaslearningcenters.com/","https://www.google.com/maps/place/Thomas+Learning+Centers/data=!4m7!3m6!1s0x876b882cbf412e57:0xcbae074e04b338ad!8m2!3d39.8512326!4d-105.0396878!16s%2Fg%2F11b5wn9wjc!19sChIJVy5BvyyIa4cRrTizBE4Hrss?authuser=0&hl=en&rclk=1","General office","303-427-8831","","Unknown","Early education / childcare prospect from user list","Preschool; 4.2 rating; 30 Google reviews","Public website and Google listing are present; audit should focus on turning parent interest into inquiry or tour requests. Review language suggests parent trust can be used more intentionally.","Verify city/contact, add one school-specific observation, then email and call.","","","Imported from user CSV. Address: 4000 Shaw Blvd. Hours/export note: Closed."
"B","New Lead","Tree of Life Childcare","Needs city verification, CO","https://treeoflifechildcarecolorado.com/","https://www.google.com/maps/place/Tree+of+Life+Childcare/data=!4m7!3m6!1s0x876c7741198392bf:0x329d41f223b6e4d9!8m2!3d39.8649989!4d-104.9408243!16s%2Fg%2F11nxc54c80!19sChIJv5KDGUF3bIcR2eS2I_JBnTI?authuser=0&hl=en&rclk=1","General office","970-319-5321","","Unknown","Early education / childcare prospect from user list","Day care center; 5 rating; 15 Google reviews","Public website and Google listing are present; audit should focus on turning parent interest into inquiry or tour requests. Review language suggests parent trust can be used more intentionally.","Verify city/contact, add one school-specific observation, then email and call.","","","Imported from user CSV. Address: . Hours/export note: Closed."
